<?xml version="1.0" encoding="UTF-8"?>
<!--Sample XML file generated by XMLSpy v2006 rel. 3 sp2 (http://www.altova.com)-->
<StandardSettings xmlns:xsi="http://www.w3.org/2001/XMLSchema-instance" xsi:noNamespaceSchemaLocation="StandardSettingsType.xsd">
	<AlgorithmParameters>
		<CurveFitParameters>
			<NoiseThreshold>300</NoiseThreshold>
			<WindowWidth>9</WindowWidth>
			<MinFitForNormalPeak>0.98</MinFitForNormalPeak>
			<TriggerFitForArtifact>0.99</TriggerFitForArtifact>
			<AbsoluteMinimumFit>0.85</AbsoluteMinimumFit>
			<TestForNegSecondaryContent>false</TestForNegSecondaryContent>
			<ParametricFitTolerance>0.999995</ParametricFitTolerance>
			<NumberOfIntegrationSteps>50</NumberOfIntegrationSteps>
			<SigmaTolerance>0.00015</SigmaTolerance>
			<SigmaWidth>10.0</SigmaWidth>
			<MaximumIterations>5</MaximumIterations>
			<SigmaRatio>4.5</SigmaRatio>
			<InterSampleSpacing>1</InterSampleSpacing>
			<SignatureSigma>2.0</SignatureSigma>
			<BlobDegree>6</BlobDegree>
			<MinDistanceBetweenPeaks>1.5</MinDistanceBetweenPeaks>
			<PeakFractionForEndPtTest>0.25</PeakFractionForEndPtTest>
			<PeakLevelForEndPtTest>60.0</PeakLevelForEndPtTest>
			<LowTailHeightThreshold>0.1</LowTailHeightThreshold>
			<LowTailSlopeThreshold>0.1</LowTailSlopeThreshold>
			<MinSamplesForSlopeRegression>4</MinSamplesForSlopeRegression>
		</CurveFitParameters>
		<LaneStandardSearch>
			<AcceptanceFactorOfMaxPeak>0.34</AcceptanceFactorOfMaxPeak>
			<EndTestFactor>0.335</EndTestFactor>
			<SkipFractionOfInitialPeaks>0.4</SkipFractionOfInitialPeaks>
			<MinCorrelationForRecursiveSearch>0.98</MinCorrelationForRecursiveSearch>
			<MaxStartPtsForPartialSearch>6</MaxStartPtsForPartialSearch>
			<BeginAnalysisProportion>0.75</BeginAnalysisProportion>
			<LaneStandardSearchSpacing>
				<MaxSpacingMultiple>1.5</MaxSpacingMultiple>
				<MinSpacingMultiple>0.6</MinSpacingMultiple>
			</LaneStandardSearchSpacing>
			<CorrelationThresholds>
				<ILSSpecificThreshold>
					<Synonym>ABI</Synonym>
					<CorrelationWiithIdeal>0.995</CorrelationWiithIdeal>
				</ILSSpecificThreshold>
				<ILSSpecificThreshold>
					<Synonym>Promega</Synonym>
					<CorrelationWiithIdeal>0.999</CorrelationWiithIdeal>
				</ILSSpecificThreshold>
			</CorrelationThresholds>
		</LaneStandardSearch>
		<LadderLocusSearch>
			<LadderLociMinimumCorrelationWithIdeal>0.999</LadderLociMinimumCorrelationWithIdeal>
			<LadderLocusSearchSpacing>
				<MaxSpacingMultiple>1.2</MaxSpacingMultiple>
				<MinSpacingMultiple>0.7</MinSpacingMultiple>
			</LadderLocusSearchSpacing>
			<MaxStartPtsForPartialSearch>6</MaxStartPtsForPartialSearch>
		</LadderLocusSearch>
	</AlgorithmParameters>
	<StandardParameters>
		<MsgDoubleResolution>10</MsgDoubleResolution>
		<MinSigmaForDyeBlob>6.0</MinSigmaForDyeBlob>
		<SecondaryContentLimitFraction>0.9</SecondaryContentLimitFraction>
		<MinFractionExpectedPeakWidth>0.6</MinFractionExpectedPeakWidth>
		<MaxMultipleExpectedPeakWidth>1.6</MaxMultipleExpectedPeakWidth>
		<WidthMatchFraction>0.1</WidthMatchFraction>
		<MaxSpikeWidth>1.0</MaxSpikeWidth>
		<CraterSigmaMultiple>2.0</CraterSigmaMultiple>
	</StandardParameters>
	<StdMarkerSetSpecifications>
		<StdMarkerSetCollection>
			<MarkerSetName>Cofiler</MarkerSetName>
			<PositiveControls>
				<PositiveControl>
					<Name>9947A</Name>
					<Loci>
						<Locus>
							<Name>D3S1358</Name>
							<Allele>
								<Name>14</Name>
								<BioID>121</BioID>
							</Allele>
							<Allele>
								<Name>15</Name>
								<BioID>125</BioID>
							</Allele>
						</Locus>
						<Locus>
							<Name>D16S539</Name>
							<Allele>
								<Name>11</Name>
								<BioID>257</BioID>
							</Allele>
							<Allele>
								<Name>12</Name>
								<BioID>261</BioID>
							</Allele>
						</Locus>
						<Locus>
							<Name>AMEL</Name>
							<Allele>
								<Name>1</Name>
								<BioID>103</BioID>
							</Allele>
						</Locus>
						<Locus>
							<Name>TH01</Name>
							<Allele>
								<Name>8</Name>
								<BioID>180</BioID>
							</Allele>
							<Allele>
								<Name>9.3</Name>
								<BioID>187</BioID>
							</Allele>
						</Locus>
						<Locus>
							<Name>TPOX</Name>
							<Allele>
								<Name>8</Name>
								<BioID>225</BioID>
							</Allele>
						</Locus>
						<Locus>
							<Name>CSF1PO</Name>
							<Allele>
								<Name>10</Name>
								<BioID>296</BioID>
							</Allele>
							<Allele>
								<Name>12</Name>
								<BioID>304</BioID>
							</Allele>
						</Locus>
						<Locus>
							<Name>D7S820</Name>
							<Allele>
								<Name>10</Name>
								<BioID>273</BioID>
							</Allele>
							<Allele>
								<Name>11</Name>
								<BioID>277</BioID>
							</Allele>
						</Locus>
					</Loci>
				</PositiveControl>
				<PositiveControl>
					<Name>9948</Name>
					<Loci>
						<Locus>
							<Name>AMEL</Name>
							<Allele>
								<Name>1</Name>
								<BioID>103</BioID>
							</Allele>
							<Allele>
								<Name>2</Name>
								<BioID>109</BioID>
							</Allele>
						</Locus>
						<Locus>
							<Name>CSF1PO</Name>
							<Allele>
								<Name>12</Name>
								<BioID>305</BioID>
							</Allele>
							<Allele>
								<Name>11</Name>
								<BioID>301</BioID>
							</Allele>
							<Allele>
								<Name>10</Name>
								<BioID>297</BioID>
							</Allele>
						</Locus>
						<Locus>
							<Name>D16S539</Name>
							<Allele>
								<Name>11</Name>
								<BioID>257</BioID>
							</Allele>
						</Locus>
						<Locus>
							<Name>D3S1358</Name>
							<Allele>
								<Name>17</Name>
								<BioID>133</BioID>
							</Allele>
							<Allele>
								<Name>15</Name>
								<BioID>125</BioID>
							</Allele>
						</Locus>
						<Locus>
							<Name>D7S820</Name>
							<Allele>
								<Name>11</Name>
								<BioID>277</BioID>
							</Allele>
						</Locus>
						<Locus>
							<Name>TH01</Name>
							<Allele>
								<Name>9.3</Name>
								<BioID>187</BioID>
							</Allele>
							<Allele>
								<Name>6</Name>
								<BioID>172</BioID>
							</Allele>
						</Locus>
						<Locus>
							<Name>TPOX</Name>
							<Allele>
								<Name>9</Name>
								<BioID>229</BioID>
							</Allele>
							<Allele>
								<Name>8</Name>
								<BioID>225</BioID>
							</Allele>
						</Locus>
					</Loci>
				</PositiveControl>
			</PositiveControls>
			<StandardOffLadderAlleles>
				<Locus>
					<Name>D3S1358</Name>
					<Allele>
						<Name>20</Name>
						<BioID>145</BioID>
					</Allele>
				</Locus>
				<Locus>
					<Name>TH01</Name>
					<Allele>
						<Name>4</Name>
						<BioID>164</BioID>
					</Allele>
					<Allele>
						<Name>11</Name>
						<BioID>192</BioID>
					</Allele>
					<Allele>
						<Name>13.3</Name>
						<BioID>203</BioID>
					</Allele>
				</Locus>
			</StandardOffLadderAlleles>
		</StdMarkerSetCollection>
		<StdMarkerSetCollection>
			<MarkerSetName>ProfilerPlus</MarkerSetName>
			<PositiveControls>
				<PositiveControl>
					<Name>9947A</Name>
					<Loci>
						<Locus>
							<Name>D3S1358</Name>
							<Allele>
								<Name>14</Name>
								<BioID>121</BioID>
							</Allele>
							<Allele>
								<Name>15</Name>
								<BioID>125</BioID>
							</Allele>
						</Locus>
						<Locus>
							<Name>VWA</Name>
							<Allele>
								<Name>17</Name>
								<BioID>180</BioID>
							</Allele>
							<Allele>
								<Name>18</Name>
								<BioID>184</BioID>
							</Allele>
						</Locus>
						<Locus>
							<Name>FGA</Name>
							<Allele>
								<Name>23</Name>
								<BioID>238</BioID>
							</Allele>
							<Allele>
								<Name>24</Name>
								<BioID>242</BioID>
							</Allele>
						</Locus>
						<Locus>
							<Name>AMEL</Name>
							<Allele>
								<Name>1</Name>
								<BioID>103</BioID>
							</Allele>
						</Locus>
						<Locus>
							<Name>D8S1179</Name>
							<Allele>
								<Name>13</Name>
								<BioID>147</BioID>
							</Allele>
						</Locus>
						<Locus>
							<Name>D21S11</Name>
							<Allele>
								<Name>30</Name>
								<BioID>210</BioID>
							</Allele>
						</Locus>
						<Locus>
							<Name>D18S51</Name>
							<Allele>
								<Name>15</Name>
								<BioID>296</BioID>
							</Allele>
							<Allele>
								<Name>19</Name>
								<BioID>312</BioID>
							</Allele>
						</Locus>
						<Locus>
							<Name>D5S818</Name>
							<Allele>
								<Name>11</Name>
								<BioID>150</BioID>
							</Allele>
						</Locus>
						<Locus>
							<Name>D13S317</Name>
							<Allele>
								<Name>11</Name>
								<BioID>217</BioID>
							</Allele>
						</Locus>
						<Locus>
							<Name>D7S820</Name>
							<Allele>
								<Name>10</Name>
								<BioID>273</BioID>
							</Allele>
							<Allele>
								<Name>11</Name>
								<BioID>277</BioID>
							</Allele>
						</Locus>
					</Loci>
				</PositiveControl>
				<PositiveControl>
					<Name>9948</Name>
					<Loci>
						<Locus>
							<Name>AMEL</Name>
							<Allele>
								<Name>1</Name>
								<BioID>103</BioID>
							</Allele>
							<Allele>
								<Name>2</Name>
								<BioID>109</BioID>
							</Allele>
						</Locus>
						<Locus>
							<Name>D13S317</Name>
							<Allele>
								<Name>11</Name>
								<BioID>217</BioID>
							</Allele>
						</Locus>
						<Locus>
							<Name>D18S51</Name>
							<Allele>
								<Name>18</Name>
								<BioID>308</BioID>
							</Allele>
							<Allele>
								<Name>15</Name>
								<BioID>296</BioID>
							</Allele>
						</Locus>
						<Locus>
							<Name>D21S11</Name>
							<Allele>
								<Name>30</Name>
								<BioID>210</BioID>
							</Allele>
							<Allele>
								<Name>29</Name>
								<BioID>206</BioID>
							</Allele>
						</Locus>
						<Locus>
							<Name>D3S1358</Name>
							<Allele>
								<Name>17</Name>
								<BioID>133</BioID>
							</Allele>
							<Allele>
								<Name>15</Name>
								<BioID>125</BioID>
							</Allele>
						</Locus>
						<Locus>
							<Name>D5S818</Name>
							<Allele>
								<Name>13</Name>